{
  "$schema": "http://json-schema.org/draft-07/schema",
  "$id": "flow.schema.json",
  "title": "ConceptForge Flow",
  "description": "A skill pipeline flow definition. Node/edge structure is compatible with Vue Flow (@vue-flow/core) and React Flow (@xyflow/react). Each file in flows/ describes one named path through the skill tree. The skill catalog (hard_gates, user_inputs, folders) lives in shared/contracts/pipeline.json — flows only define the graph and parameters.",
  "type": "object",
  "required": ["id", "name", "nodes", "edges"],
  "additionalProperties": false,
  "properties": {

    "$schema": { "type": "string" },

    "id": {
      "type": "string",
      "pattern": "^[a-z][a-z0-9-]*$",
      "description": "Unique flow identifier, kebab-case. Matches the filename without .json."
    },

    "version": {
      "type": "string",
      "default": "1.0"
    },

    "name": {
      "type": "string",
      "description": "Human-readable display name shown in UI flow picker."
    },

    "description": {
      "type": "string"
    },

    "meta": {
      "type": "object",
      "additionalProperties": false,
      "description": "Display metadata for the flow picker UI.",
      "properties": {
        "icon":     { "type": "string", "description": "Iconify icon name, e.g. i-heroicons-rocket-launch" },
        "category": {
          "type": "string",
          "enum": ["full-stack", "prototype", "concept", "cli", "maintenance", "incremental"],
          "description": "Groups flows in the UI picker."
        },
        "tags": { "type": "array", "items": { "type": "string" } },
        "onboarding": {
          "type": "object",
          "description": "Controls the onboarding dialog the orchestrator shows before starting.",
          "additionalProperties": false,
          "properties": {
            "input_style": {
              "type": "string",
              "enum": ["freeform", "structured", "repo"],
              "description": "freeform = single text box, structured = named fields, repo = repo URL + branch"
            },
            "placeholder": { "type": "string" },
            "fields": {
              "type": "array",
              "items": { "type": "string" },
              "description": "Field IDs shown when input_style is structured."
            }
          }
        }
      }
    },

    "globals": {
      "type": "object",
      "description": "Parameters injected into EVERY skill node in this flow. Per-node data.parameters are merged over globals at runtime (node wins on conflict).",
      "properties": {
        "research_depth": {
          "type": "string",
          "enum": ["skip", "light", "moderate", "deep"],
          "description": "Passed to the research mode skill and used by orchestrator to decide how much context to gather."
        },
        "approval_mode": {
          "type": "string",
          "enum": ["checkpoint", "auto_approve"],
          "description": "checkpoint = CHECKPOINT directives pause for human confirmation. auto_approve = orchestrator continues if quality score passes."
        },
        "auto_review": {
          "type": "boolean",
          "description": "Run concept-review + lint between phases automatically."
        },
        "subagent_mode": {
          "type": "boolean",
          "description": "Run each skill node in an isolated subagent context (fresh token budget)."
        },
        "verbosity": {
          "type": "string",
          "enum": ["brief", "standard", "detailed"],
          "description": "Controls how verbose skill completion summaries are."
        }
      },
      "additionalProperties": true,
      "description_extra": "additionalProperties:true allows flow authors to define custom globals passed through to all skills."
    },

    "modes": {
      "type": "object",
      "description": "Parallel/utility mode skills that run alongside the main flow. These are not nodes in the graph — they fire automatically based on triggers.",
      "additionalProperties": false,
      "properties": {
        "research": {
          "type": "object",
          "additionalProperties": false,
          "description": "Research mode: runs concept/discovery/research in parallel with main flow nodes.",
          "properties": {
            "enabled":   { "type": "boolean" },
            "skill":     { "type": "string", "default": "concept/discovery/research" },
            "triggers": {
              "type": "array",
              "items": { "type": "string" },
              "description": "Node IDs after which the research skill fires in parallel."
            },
            "parameters": {
              "type": "object",
              "additionalProperties": true,
              "description": "Extra parameters passed to the research skill (merged over globals)."
            }
          }
        },
        "standards": {
          "type": "object",
          "additionalProperties": false,
          "description": "Standards discovery mode: runs standards/discover once before implementation.",
          "properties": {
            "enabled":       { "type": "boolean" },
            "skill":         { "type": "string", "default": "standards/discover" },
            "inject_skill":  { "type": "string", "default": "standards/inject" },
            "trigger_after": { "type": "string", "description": "Node ID after which standards/discover runs. Typically 'overview'." },
            "parameters": {
              "type": "object",
              "additionalProperties": true
            }
          }
        }
      }
    },

    "nodes": {
      "type": "array",
      "minItems": 1,
      "description": "Skill execution nodes + optional group containers. Vue Flow compatible.",
      "items": {
        "oneOf": [
          { "$ref": "#/$defs/skill-node" },
          { "$ref": "#/$defs/group-node" }
        ]
      }
    },

    "edges": {
      "type": "array",
      "description": "Directed edges defining execution order. Vue Flow compatible.",
      "items": { "$ref": "#/$defs/flow-edge" }
    },

    "entry": {
      "type": "string",
      "description": "Node ID of the first skill to execute. Defaults to the node with no incoming edges. If multiple roots exist, this resolves ambiguity."
    }

  },

  "$defs": {

    "skill-node": {
      "type": "object",
      "required": ["id", "type", "position", "data"],
      "additionalProperties": false,
      "description": "A skill execution node. type must be 'skill'.",
      "properties": {
        "id": {
          "type": "string",
          "description": "Unique within this flow. Typically the short skill name (e.g. 'overview', 'features')."
        },
        "type": {
          "type": "string",
          "const": "skill"
        },
        "position": {
          "type": "object",
          "required": ["x", "y"],
          "additionalProperties": false,
          "properties": {
            "x": { "type": "number" },
            "y": { "type": "number" }
          }
        },
        "parentNode": {
          "type": "string",
          "description": "ID of a group-node that visually contains this node. Position becomes relative to parent."
        },
        "data": {
          "type": "object",
          "required": ["skill"],
          "additionalProperties": false,
          "properties": {
            "skill": {
              "type": "string",
              "description": "Skill path from skills root, e.g. 'concept/discovery/overview'. Must match an id in pipeline.json steps."
            },
            "label": {
              "type": "string",
              "description": "Display label in flow editor. Defaults to skill's name field."
            },
            "optional": {
              "type": "boolean",
              "default": false,
              "description": "Orchestrator may skip this node based on user preference during onboarding."
            },
            "parallel_group": {
              "type": "string",
              "description": "Nodes with the same parallel_group can execute concurrently once their source edges are satisfied."
            },
            "subagent": {
              "type": "boolean",
              "description": "Override globals.subagent_mode for this node only."
            },
            "parameters": {
              "type": "object",
              "additionalProperties": true,
              "description": "Skill-specific parameters. Merged over globals at runtime (these win). Passed to the skill as runtime config."
            }
          }
        }
      }
    },

    "group-node": {
      "type": "object",
      "required": ["id", "type", "position", "data"],
      "additionalProperties": false,
      "description": "A visual group container (phase label). Does not execute. skill-nodes can use parentNode to nest inside.",
      "properties": {
        "id":   { "type": "string" },
        "type": { "type": "string", "const": "group" },
        "position": {
          "type": "object",
          "required": ["x", "y"],
          "additionalProperties": false,
          "properties": {
            "x": { "type": "number" },
            "y": { "type": "number" }
          }
        },
        "style": {
          "type": "object",
          "description": "CSS styles for the group container (width, height, background, border, etc.).",
          "additionalProperties": true
        },
        "data": {
          "type": "object",
          "additionalProperties": false,
          "properties": {
            "label": { "type": "string", "description": "Phase/group display name." },
            "phase": { "type": "string", "description": "Pipeline phase this group represents." }
          }
        }
      }
    },

    "flow-edge": {
      "type": "object",
      "required": ["id", "source", "target"],
      "additionalProperties": false,
      "description": "A directed edge from source node to target node. Vue Flow compatible.",
      "properties": {
        "id":           { "type": "string" },
        "source":       { "type": "string", "description": "Source node ID." },
        "target":       { "type": "string", "description": "Target node ID." },
        "sourceHandle": { "type": "string" },
        "targetHandle": { "type": "string" },
        "type": {
          "type": "string",
          "enum": ["flow", "optional", "parallel"],
          "default": "flow",
          "description": "flow = required sequence edge. optional = target may be skipped. parallel = source and target can overlap execution."
        },
        "animated": { "type": "boolean", "default": false },
        "label":    { "type": "string" },
        "data": {
          "type": "object",
          "additionalProperties": true,
          "properties": {
            "condition": {
              "type": "string",
              "description": "Optional condition expression. If false, edge is not traversed."
            }
          }
        }
      }
    }

  }
}
