{
  "$schema": "./flow.schema.json",
  "id": "concept-only",
  "version": "1.0",
  "name": "Concept Only",
  "description": "Produces a complete concept document package without implementation. For planning, documentation, or handing off to a development team.",
  "meta": {
    "icon": "i-heroicons-document-text",
    "category": "concept",
    "tags": ["concept", "documentation", "planning", "handoff", "no-code"],
    "onboarding": {
      "input_style": "structured",
      "fields": ["app_name", "problem", "audience", "notes"]
    }
  },
  "globals": {
    "research_depth": "moderate",
    "approval_mode": "checkpoint",
    "auto_review": true,
    "subagent_mode": true,
    "verbosity": "detailed"
  },
  "modes": {
    "research": {
      "enabled": true,
      "skill": "concept/discovery/research",
      "triggers": ["overview", "features", "brand-visual", "datamodel", "screens"],
      "parameters": {
        "topics": ["domain", "competitors", "audiences", "design_inspiration", "patterns"]
      }
    },
    "standards": {
      "enabled": false
    }
  },
  "nodes": [
    {
      "id": "g-concept",
      "type": "group",
      "position": { "x": 0, "y": 0 },
      "style": { "width": 1400, "height": 480, "backgroundColor": "rgba(99,102,241,0.04)", "border": "1px solid rgba(99,102,241,0.2)", "borderRadius": "12px" },
      "data": { "label": "Concept", "phase": "conceptualization" }
    },

    { "id": "overview",        "type": "skill", "parentNode": "g-concept", "position": { "x": 40,   "y": 200 }, "data": { "skill": "concept/discovery/overview",        "label": "Project Brief",    "optional": false } },
    { "id": "journeys",        "type": "skill", "parentNode": "g-concept", "position": { "x": 280,  "y": 80  }, "data": { "skill": "concept/experience/journeys",       "label": "User Journeys",    "optional": false, "parameters": { "hero_approval_required": true } } },
    { "id": "brand-visual",    "type": "skill", "parentNode": "g-concept", "position": { "x": 280,  "y": 240 }, "data": { "skill": "concept/discovery/brand-visual",    "label": "Brand Visual",     "optional": false, "parallel_group": "identity" } },
    { "id": "techstack",       "type": "skill", "parentNode": "g-concept", "position": { "x": 280,  "y": 380 }, "data": { "skill": "concept/blueprint/techstack",       "label": "Tech Stack",       "optional": false, "parallel_group": "identity" } },
    { "id": "features",        "type": "skill", "parentNode": "g-concept", "position": { "x": 560,  "y": 200 }, "data": { "skill": "concept/experience/features",       "label": "Features",         "optional": false, "subagent": true } },
    { "id": "brand-behavioral","type": "skill", "parentNode": "g-concept", "position": { "x": 560,  "y": 80  }, "data": { "skill": "concept/discovery/brand-behavioral","label": "Brand Behavioral", "optional": true  } },
    { "id": "behaviors",       "type": "skill", "parentNode": "g-concept", "position": { "x": 560,  "y": 340 }, "data": { "skill": "concept/experience/behaviors",      "label": "Behaviors",        "optional": true  } },
    { "id": "architecture",    "type": "skill", "parentNode": "g-concept", "position": { "x": 840,  "y": 80  }, "data": { "skill": "concept/blueprint/architecture",    "label": "Architecture",     "optional": false, "subagent": true } },
    { "id": "datamodel",       "type": "skill", "parentNode": "g-concept", "position": { "x": 840,  "y": 240 }, "data": { "skill": "concept/blueprint/datamodel",       "label": "Data Model",       "optional": false, "subagent": true } },
    { "id": "screens",         "type": "skill", "parentNode": "g-concept", "position": { "x": 1120, "y": 200 }, "data": { "skill": "concept/experience/screens",        "label": "Screens",          "optional": false, "subagent": true } },
    { "id": "components",      "type": "skill", "parentNode": "g-concept", "position": { "x": 1120, "y": 60  }, "data": { "skill": "concept/experience/components",     "label": "Components",       "optional": true  } },
    { "id": "storybook",       "type": "skill", "parentNode": "g-concept", "position": { "x": 1120, "y": 200 }, "data": { "skill": "concept/experience/storybook",      "label": "Storybook",        "optional": true  } },
    { "id": "mock",            "type": "skill", "parentNode": "g-concept", "position": { "x": 1120, "y": 340 }, "data": { "skill": "concept/experience/mock",           "label": "Mockups",          "optional": true,  "parameters": { "framework": "vue" } } }
  ],
  "edges": [
    { "id": "e-overview-journeys",     "source": "overview",       "target": "journeys",        "type": "flow"     },
    { "id": "e-overview-brand",        "source": "overview",       "target": "brand-visual",    "type": "parallel" },
    { "id": "e-overview-techstack",    "source": "overview",       "target": "techstack",       "type": "parallel" },
    { "id": "e-journeys-features",     "source": "journeys",       "target": "features",        "type": "flow"     },
    { "id": "e-brand-behavioral",      "source": "brand-visual",   "target": "brand-behavioral","type": "optional" },
    { "id": "e-features-behaviors",    "source": "features",       "target": "behaviors",       "type": "optional" },
    { "id": "e-features-architecture", "source": "features",       "target": "architecture",    "type": "flow"     },
    { "id": "e-techstack-architecture","source": "techstack",      "target": "architecture",    "type": "flow"     },
    { "id": "e-features-datamodel",    "source": "features",       "target": "datamodel",       "type": "flow"     },
    { "id": "e-techstack-datamodel",   "source": "techstack",      "target": "datamodel",       "type": "flow"     },
    { "id": "e-architecture-datamodel","source": "architecture",   "target": "datamodel",       "type": "flow"     },
    { "id": "e-behaviors-datamodel",   "source": "behaviors",      "target": "datamodel",       "type": "optional" },
    { "id": "e-datamodel-screens",     "source": "datamodel",      "target": "screens",         "type": "flow"     },
    { "id": "e-brand-screens",         "source": "brand-visual",   "target": "screens",         "type": "flow"     },
    { "id": "e-techstack-screens",     "source": "techstack",      "target": "screens",         "type": "flow"     },
    { "id": "e-screens-components",    "source": "screens",        "target": "components",      "type": "optional" },
    { "id": "e-screens-storybook",     "source": "screens",        "target": "storybook",       "type": "optional" },
    { "id": "e-techstack-storybook",   "source": "techstack",      "target": "storybook",       "type": "optional" },
    { "id": "e-brand-storybook",       "source": "brand-visual",   "target": "storybook",       "type": "optional" },
    { "id": "e-screens-mock",          "source": "screens",        "target": "mock",            "type": "optional" }
  ],
  "entry": "overview"
}
